{
  "$schema": "https://json-schema.org/draft/2020-12/schema",
  "type": "object",
  "properties": {
    "schemaVersion": {
      "type": "number",
      "const": 1
    },
    "curriculumVersion": {
      "type": "string",
      "pattern": "^\\d+\\.\\d+\\.\\d+$"
    },
    "templateVersion": {
      "type": "string",
      "pattern": "^\\d+\\.\\d+\\.\\d+$"
    },
    "milestoneId": {
      "type": "string",
      "allOf": [
        {
          "pattern": "^(?:track|gate|module|lesson|assessment|milestone|project|exercise|ex|lab|check|rubric|evidence|release|remediation|change-request|debugging)-[a-z0-9]+(?:-[a-z0-9]+)*$"
        },
        {
          "pattern": "^milestone-"
        }
      ]
    },
    "repository": {
      "type": "object",
      "properties": {
        "url": {
          "allOf": [
            {
              "type": "string",
              "format": "uri"
            },
            {
              "type": "string",
              "pattern": "^https:\\/\\/"
            }
          ]
        },
        "commit": {
          "type": "string",
          "pattern": "^[0-9a-f]{40}$"
        },
        "attestations": {
          "minItems": 1,
          "type": "array",
          "items": {
            "type": "string",
            "enum": [
              "self-reported",
              "repository-verifiable",
              "ci-verified",
              "externally-observable",
              "human-reviewed"
            ]
          },
          "uniqueItems": true
        }
      },
      "required": ["url", "commit", "attestations"],
      "additionalProperties": false
    },
    "deployment": {
      "type": "object",
      "properties": {
        "frontend": {
          "allOf": [
            {
              "type": "string",
              "format": "uri"
            },
            {
              "type": "string",
              "pattern": "^https:\\/\\/"
            }
          ]
        },
        "api": {
          "allOf": [
            {
              "type": "string",
              "format": "uri"
            },
            {
              "type": "string",
              "pattern": "^https:\\/\\/"
            }
          ]
        },
        "attestations": {
          "minItems": 1,
          "type": "array",
          "items": {
            "type": "string",
            "enum": [
              "self-reported",
              "repository-verifiable",
              "ci-verified",
              "externally-observable",
              "human-reviewed"
            ]
          },
          "uniqueItems": true
        }
      },
      "required": ["attestations"],
      "additionalProperties": false,
      "anyOf": [
        {
          "required": ["frontend"]
        },
        {
          "required": ["api"]
        }
      ]
    },
    "verification": {
      "type": "object",
      "properties": {
        "ciRun": {
          "allOf": [
            {
              "type": "string",
              "format": "uri"
            },
            {
              "type": "string",
              "pattern": "^https:\\/\\/"
            }
          ]
        },
        "status": {
          "type": "string",
          "enum": ["passed", "failed"]
        },
        "attestations": {
          "minItems": 1,
          "type": "array",
          "items": {
            "type": "string",
            "enum": [
              "self-reported",
              "repository-verifiable",
              "ci-verified",
              "externally-observable",
              "human-reviewed"
            ]
          },
          "uniqueItems": true
        }
      },
      "required": ["ciRun", "status", "attestations"],
      "additionalProperties": false,
      "not": {
        "properties": {
          "status": {
            "const": "failed"
          },
          "attestations": {
            "contains": {
              "const": "ci-verified"
            }
          }
        },
        "required": ["status", "attestations"]
      }
    },
    "artifacts": {
      "minItems": 1,
      "type": "array",
      "items": {
        "type": "object",
        "properties": {
          "id": {
            "type": "string",
            "allOf": [
              {
                "pattern": "^(?:track|gate|module|lesson|assessment|milestone|project|exercise|ex|lab|check|rubric|evidence|release|remediation|change-request|debugging)-[a-z0-9]+(?:-[a-z0-9]+)*$"
              },
              {
                "pattern": "^evidence-"
              }
            ]
          },
          "path": {
            "type": "string",
            "pattern": "^(?![\\s\\S]*[\\u0000-\\u001f\\u007f-\\u009f\\u2028\\u2029])(?!\\.{1,2}(?:\\/|$))(?!.*\\/\\.{1,2}(?:\\/|$))(?!(?:[^/]*\\/)*(?:[cC][oO][nN]|[pP][rR][nN]|[aA][uU][xX]|[nN][uU][lL]|[cC][oO][mM][1-9\\u00b9\\u00b2\\u00b3]|[lL][pP][tT][1-9\\u00b9\\u00b2\\u00b3])(?:\\.[^/]*)?(?:\\/|$))(?!(?:[^/]*\\/)*[^/]*[. ](?:\\/|$))[^/:\\\\<>\"|?*]+(?:\\/[^/:\\\\<>\"|?*]+)*$"
          },
          "attestations": {
            "minItems": 1,
            "type": "array",
            "items": {
              "type": "string",
              "enum": [
                "self-reported",
                "repository-verifiable",
                "ci-verified",
                "externally-observable",
                "human-reviewed"
              ]
            },
            "uniqueItems": true
          }
        },
        "required": ["id", "path", "attestations"],
        "additionalProperties": false
      }
    }
  },
  "required": [
    "schemaVersion",
    "curriculumVersion",
    "templateVersion",
    "milestoneId",
    "repository",
    "verification",
    "artifacts"
  ],
  "additionalProperties": false,
  "$comment": "Draft 2020-12 cannot express uniqueness of artifacts[].id across distinct objects. This schema provides structural prevalidation only; every supported consumer must also parse the manifest with EvidenceManifestSchema."
}
